{
  "test_name": "aws_c5_4xlarge_benchmark_001",
  "timestamp": "2024-01-15T16:45:00Z",
  "test_duration_sec": 300,
  "memory_idle_latency_ns": 110.8,
  "memory_peak_injection_bandwidth_mbs": 15200.0,
  "ramspeed_smp_bandwidth_mbs_add": 13800.0,
  "ramspeed_smp_bandwidth_mbs_copy": 13400.0,
  "sysbench_ram_memory_bandwidth_mibs": 14500,
  "sysbench_ram_memory_test_duration_sec": 60,
  "sysbench_ram_memory_test_mode": "seq",
  "sysbench_cpu_events_per_second": 12200,
  "sysbench_cpu_duration_sec": 60,
  "sysbench_cpu_test_mode": "cpu",
  "cpu_utilization_percent": 95.8,
  "memory_utilization_percent": 68.5,
  "load_average_1min": 7.2,
  "load_average_5min": 5.8,
  "load_average_15min": 4.1,
  "threads_used": 8,
  "cpu_cores": 8,
  "memory_total_mb": 32768,
  "memory_available_mb": 10240,
  "test_parameters": {
    "block_size": "4KB",
    "access_pattern": "sequential",
    "warmup_time_sec": 30,
    "iterations": 3
  },
  "error_count": 0,
  "warnings": ["CPU throttling detected during peak load"],
  "metadata": {
    "tool_version": "sysbench-1.0.20",
    "os_info": "Ubuntu 22.04.3 LTS",
    "kernel_version": "5.15.0-88-generic",
    "cpu_model": "Intel Xeon Platinum 8124M CPU @ 3.00GHz",
    "memory_type": "DDR4",
    "cloud_provider": "AWS",
    "instance_type": "c5.4xlarge"
  }
}
